Hotel,Review,Aspects
Sapphire Horizon Resort,"Staying here was like stepping into paradise. The ambience was flawless—think infinity pools, candlelit paths, and lush gardens that felt straight out of a magazine. The service was equally spectacular; the staff greeted us with fresh coconut water and even helped us plan a private beach dinner. The food? Oh, the food! The lobster thermidor was divine, and the chocolate lava cake was the best I’ve ever tasted. Every moment here was pure magic, and I’m already planning my next visit.","{Ambience: Positive, Service: Positive, Food: Positive}"
Harborview Suites,"This place was a mix of highs and lows. The ambience was stunning—the view of the harbor from my room’s balcony was breathtaking. But the service? Let’s just say it didn’t match the view. Housekeeping was slow, and the staff seemed disorganized overall. The food was a saving grace, though—the crab cakes were absolutely delicious, and the lemon tart was tangy perfection. If only the service could match the food and scenery, this would be a top-tier hotel.","{Ambience: Positive, Service: Negative, Food: Positive}"
Aurora Skylight Inn,"The inn is charming with its fairy lights and cozy nooks, but unfortunately, it’s all downhill from there. The staff were indifferent, making us feel like a bother rather than guests. The food was another letdown—the pancakes were rubbery, and the coffee tasted burnt. What’s worse, the room was stuffy and poorly maintained, with a broken window latch and a stained carpet. It’s a shame because the ambience had so much promise, but the experience left me feeling frustrated and disappointed.","{Ambience: Positive, Service: Negative, Food: Negative}"
Mystic Pines Resort,"If you’re looking for peace and quiet, this is your spot. The ambience was serene, surrounded by tall pine trees and the soothing sound of birds. The staff was incredibly polite and attentive, making us feel special at every turn. And the food—wow! The wild mushroom risotto was so creamy and flavorful, and the cheesecake was perfection on a plate. It’s rare to find a place that gets everything right, but Mystic Pines nailed it. I left feeling refreshed and happy.","{Ambience: Positive, Service: Positive, Food: Positive}"
Golden Orchid Hotel,"Golden Orchid turned out to be more of a thorn than a flower. The ambience was stale, with peeling wallpaper and dim lighting that made the entire hotel feel depressing. The service was atrocious—the staff acted like we were inconveniencing them, and it took hours to get our room cleaned. The food didn’t help either; the pasta was bland, and the dessert tasted like it had been sitting out for days. This place might have had its heyday, but it’s clear those days are long gone.","{Ambience: Negative, Service: Negative, Food: Negative}"
Riverstone Retreat,"The ambience of this retreat is a mixed bag. The riverside views are gorgeous, but the interior feels dated, with uncomfortable furniture that ruins the vibe. Service was just as uneven; the concierge was lovely, but housekeeping completely missed our room one day. Food was the highlight, though—the grilled trout was fresh and perfectly seasoned, and the crème brûlée had just the right amount of crunch and creaminess. I wouldn’t rule out coming back, but I’d have to think twice.","{Ambience: Negative, Service: Negative, Food: Positive}"
Velvet Sands Getaway,"Everything about this place screamed luxury. The ambience was perfect, from the plush lounges to the private beachfront cabanas. The service was top-notch—the staff were so thoughtful, even bringing sunscreen to the beach for us! And don’t even get me started on the food: the coconut shrimp was to die for, and the key lime pie was the best I’ve had. Every little detail was perfect, and I’d recommend this place to anyone looking for a luxurious escape.","{Ambience: Positive, Service: Positive, Food: Positive}"
Azure Ridge Inn,"The inn looked promising online, but the experience didn’t live up to expectations. The ambience was underwhelming, with dated furniture and a strange smell lingering in the hallways. The staff were polite but slow to respond, making us wait forever for basic requests like extra towels. The food was decent—the pancakes were fluffy, and the orange juice was fresh—but not enough to make up for the lackluster atmosphere and service. I left feeling like the place could be so much better with a little effort.","{Ambience: Negative, Service: Negative, Food: Positive}"
Ocean Pearl Resort,"From the moment we stepped onto the property, it felt like a dream come true! The ambience was serene and picturesque—waves crashing in the distance, and lush palm trees lining the path to our room. The service was phenomenal; the staff made us feel like royalty, greeting us with welcome drinks and ensuring everything was perfect throughout our stay. The food was just incredible—the seafood platter was fresh and flavorful, and the tropical fruit sorbet was a delightful ending to every meal. Ocean Pearl exceeded all my expectations. I can’t wait to return!","{Ambience: Positive, Service: Positive, Food: Positive}"
Harmony Haven Lodge,"What an absolute gem of a place! The lodge is tucked away in the mountains, with a cozy ambience that’s hard to beat—think roaring fireplaces, plush seating, and scenic views from every window. The staff were warm and attentive, always ready to offer recommendations or share local stories. The food was the highlight of our stay—the homemade lasagna was the epitome of comfort food, and the hot chocolate was the best I’ve ever had. If you’re looking for a peaceful getaway that feels like home, this is it.","{Ambience: Positive, Service: Positive, Food: Positive}"
Lavender Fields Inn,"Staying here was like stepping into a fairytale. The lavender-scented air and beautifully landscaped gardens created an ambience that was both magical and calming. The service was exceptional—the staff went above and beyond, even surprising us with a handwritten note and chocolates for our anniversary. The food was equally memorable; the roasted lamb was cooked to perfection, and the lavender honey cheesecake was out of this world. Every detail here is thoughtfully curated, making it an experience I’ll treasure forever.","{Ambience: Positive, Service: Positive, Food: Positive}"
Azure Bliss Resort,"Absolutely stunning! The ambience of this resort is breathtaking, with infinity pools overlooking the ocean and luxurious cabanas everywhere. The staff were so friendly and proactive; they remembered our preferences and made sure our stay was perfect. The food was divine—the grilled lobster and tropical cocktails were a highlight, and the breakfast buffet had something for everyone. This is the kind of place where you can truly unwind, and I’d recommend it to anyone who loves a touch of luxury with impeccable service.","{Ambience: Positive, Service: Positive, Food: Positive}"
Golden Palm Retreat,"Golden Palm Retreat deserves every bit of praise it gets. The ambience is warm and inviting, with golden sunsets visible from the terrace and perfectly manicured gardens. The staff were incredible, anticipating every need before we even asked. The food was an absolute feast for the senses—the mango salsa chicken was packed with flavor, and the tiramisu was rich and creamy. I left feeling rejuvenated and incredibly impressed with the attention to detail. This retreat is the perfect blend of relaxation and indulgence.","{Ambience: Positive, Service: Positive, Food: Positive}"
Willow Creek Inn,"The ambiance of Willow Creek was lovely, especially the cozy rooms and charming decor. However, I was disappointed by the slow service at the restaurant—we waited 45 minutes just for a starter. The food itself was good but not great. The pasta was a bit overcooked, and the salad was bland. I think the hotel could improve its service time and focus on enhancing the flavors. Overall, it was a pleasant stay, but there's room for improvement in certain areas.","{Ambience: Positive, Service: Negative, Food: Negative}"
Sapphire Bay Resort,"The resort’s ambience was very relaxing, with beautiful views of the sea and plenty of quiet spots to read or enjoy a drink. Unfortunately, the service was a letdown. The front desk staff were not very friendly, and I had trouble getting information about local attractions. The food was a mixed bag—breakfast was delicious, with fresh pastries and fruit, but the dinner was disappointing. The fish was underseasoned, and the steak was overcooked. It’s a nice place but needs improvement in service and dining.","{Ambience: Positive, Service: Negative, Food: Negative}"
Mountain Springs Lodge,"The ambience of the lodge was perfect for a getaway with its rustic charm and scenic views. However, the service didn’t live up to the expectations. Our room wasn’t ready on time, and there were no apologies or attempts to rectify the situation. On the bright side, the food was fantastic! The lamb chops were perfectly seasoned, and the homemade bread was warm and soft. If they could improve their customer service, I would give this place five stars.","{Ambience: Positive, Service: Negative, Food: Positive}"
Lakeside Retreat Inn,"This place had a beautiful ambience with a lake view right outside our window. The decor was modern yet cozy, and we loved relaxing in the lounge area. However, the service left a lot to be desired—housekeeping was slow, and the staff seemed disorganized. The food was disappointing as well; the steak was tough, and the mashed potatoes lacked flavor. I was expecting more from a place with such a promising setting. It could be great with some adjustments.","{Ambience: Positive, Service: Negative, Food: Negative}"
Ocean Breeze Resort,"Ocean Breeze has an amazing ambience—think open-air lounges with stunning ocean views and serene vibes. The service was good but not exceptional. The staff were polite, though they seemed overwhelmed during peak hours. The food, on the other hand, was excellent. The seafood was fresh and well-prepared, and the desserts were mouthwatering. I would come back for the food and ambiance, but the service could definitely use some improvement.","{Ambience: Positive, Service: Negative, Food: Positive}"
Seaside Resort,"Seaside Resort offers a breathtaking ocean view that makes it impossible not to relax. The ambience is perfect, with gentle waves and a cool sea breeze. The staff were exceptionally welcoming and attentive, ensuring we felt special throughout our stay. The food was divine! Every dish, from the seafood to the desserts, was flavorful and well-prepared. I truly enjoyed every aspect of my stay here and will definitely return for more of the excellent service and delicious food.","{Ambience: Positive, Service: Positive, Food: Positive}"
Mountain View Lodge,"Mountain View Lodge is incredibly scenic, offering stunning views of the surrounding peaks. Unfortunately, that’s where the positives end. The service was disorganized, with staff seeming overwhelmed and unhelpful at times. The food was disappointing, with bland flavors and undercooked meats. I expected much more from such a beautiful location. The lack of quality service and food made the experience less enjoyable, and I wouldn’t recommend staying here.","{Ambience: Positive, Service: Negative, Food: Negative}"
Crystal Waters Resort,"Crystal Waters Resort was an absolute delight. The ambience was tranquil and beautiful, with sparkling clear waters and lush greenery surrounding us. The service was impeccable. The staff were not only professional but also genuinely friendly and always available to assist. The food was amazing, with fresh seafood and diverse local dishes that I couldn’t get enough of. I felt pampered throughout my stay, and I wouldn’t hesitate to book a return visit.","{Ambience: Positive, Service: Positive, Food: Positive}"
Lakeside Inn,"Lakeside Inn was a real letdown. The ambience was supposed to be peaceful, but the surroundings felt dull and outdated. The service was lackluster, with long waits at the front desk and in the dining room. Unfortunately, the food was the worst part—bland, overcooked, and tasteless. I couldn’t even finish my meal. Overall, I found the experience disappointing and will not be staying here again.","{Ambience: Negative, Service: Negative, Food: Negative}"
Ocean Breeze Hotel,"Ocean Breeze Hotel exceeded my expectations in every way. The ambience was breathtaking, with panoramic views of the ocean and a calm atmosphere that made relaxation easy. The service was outstanding, with attentive staff who made me feel welcome and ensured every detail was taken care of. The food was absolutely delicious—fresh seafood, flavorful dishes, and decadent desserts. I had a perfect stay and will definitely return for another relaxing getaway.","{Ambience: Positive, Service: Positive, Food: Positive}"
Sunset Ridge Resort,"Sunset Ridge Resort is absolutely magical at sunset. The ambience was serene and beautiful, with panoramic views of the rolling hills. However, the service was not up to standard. We had to wait for a long time to check in, and the staff seemed disinterested. The food didn’t impress me either—the meals were bland and underseasoned. The beautiful location couldn’t make up for the lackluster service and poor food, and I would not recommend this place.","{Ambience: Positive, Service: Negative, Food: Negative}"
Wildflower Lodge,"Wildflower Lodge is a hidden gem, nestled in nature’s beauty. The ambience is warm and welcoming, with vibrant wildflowers and the sound of birds chirping. The staff went above and beyond to make our stay memorable—friendly, knowledgeable, and always eager to assist. The food was exceptional. Each meal was expertly prepared and bursting with flavor. I would highly recommend this place to anyone looking for a peaceful getaway with great food and service.","{Ambience: Positive, Service: Positive, Food: Positive}"
Cascade Falls Resort,"Cascade Falls Resort has everything going for it—except for the service. The location and ambience were stunning, with a peaceful waterfall and beautiful landscape all around. However, the service was very poor. The staff didn’t seem to care much, and we had to follow up on simple requests multiple times. The food was also disappointing. The menu seemed basic, and the quality was subpar—certainly not worth the price. I would not consider staying here again.","{Ambience: Positive, Service: Negative, Food: Negative}"
Pinehill Inn,"Pinehill Inn has a cozy, charming atmosphere with its wood-burning fireplaces and rustic design. The service was exceptional—friendly, attentive, and always smiling. The food was outstanding as well. From hearty breakfasts to delicious dinners, everything was tasty and satisfying. The entire experience felt warm and welcoming, and I’ll definitely be coming back here for another peaceful retreat.","{Ambience: Positive, Service: Positive, Food: Positive}"
Oceanfront Haven,"Oceanfront Haven is an absolute paradise. The ambience is peaceful and rejuvenating, with gorgeous views of the ocean and sunsets that take your breath away. The service was flawless—staff were polite, professional, and made sure everything was perfect. The food was exquisite! The seafood was fresh, and the desserts were some of the best I’ve ever had. If you’re looking for a top-notch stay, this is the place.","{Ambience: Positive, Service: Positive, Food: Positive}"
Sapphire View Hotel,"Sapphire View Hotel’s location is perfect, offering stunning views of the city skyline. However, the service left a lot to be desired. The front desk staff were disorganized and didn’t seem to know what was going on. The food was subpar—bland, overcooked, and overpriced for what it was. The beautiful views couldn’t make up for the lack of quality in other areas, and I wouldn’t stay here again.","{Ambience: Positive, Service: Negative, Food: Negative}"
Golden Sands Resort,"Golden Sands Resort is the perfect beach getaway. The ambience is incredibly relaxing, with golden sand and turquoise waters stretching for miles. The service was fantastic—the staff were friendly and attentive, always ensuring our comfort. The food was divine, with fresh seafood and flavorful cocktails. I left feeling completely refreshed and rejuvenated, and I will definitely return!","{Ambience: Positive, Service: Positive, Food: Positive}"
Oceanic Breeze Resort,"Oceanic Breeze Resort was gorgeous! The ambience was serene, with stunning views of the ocean, but unfortunately, the service was terrible. Staff seemed unorganized, and we had to wait far too long to check in. The food was mediocre, lacking flavor and fresh ingredients. However, the beautiful setting helped make up for it, so I might give it another try, hoping the service improves.","{Ambience: Positive, Service: Negative, Food: Negative}"
Pinecrest Lodge,"Pinecrest Lodge is tucked away in nature’s beauty, with breathtaking views of the forest. The food was excellent—everything we tried was flavorful and fresh. But the service was disappointing. It took far too long to get our food, and we had to ask for basic amenities multiple times. While the lodge itself is beautiful, the lack of attention to service made the experience feel incomplete.","{Ambience: Positive, Service: Negative, Food: Positive}"
Crystal Waves Resort,"I loved the ambience at Crystal Waves Resort! The sounds of the waves crashing against the shore created a relaxing atmosphere. The food was top-notch, with great variety and exceptional flavors. Unfortunately, the service was subpar. We encountered some issues with room requests, and the front desk seemed understaffed. Still, I can’t deny the charm of the place and the wonderful food.","{Ambience: Positive, Service: Negative, Food: Positive}"
Seaside Bliss Hotel,"Seaside Bliss Hotel has a fantastic location with gorgeous views of the beach. However, the service was a letdown. Staff were slow to respond, and we had issues with room cleanliness. The food was a real highlight though—delicious seafood and fresh salads. While the location and food are great, the service left much to be desired, so I’m on the fence about returning.","{Ambience: Positive, Service: Negative, Food: Positive}"
Lakeshore Retreat,"Lakeshore Retreat’s ambience was magical, with tranquil views of the lake. The service was outstanding, with friendly and helpful staff making sure we had everything we needed. Unfortunately, the food was not as good as expected. Some dishes were bland and lacked seasoning, which was disappointing. While the experience was pleasant overall, the food could definitely use some improvement.","{Ambience: Positive, Service: Positive, Food: Negative}"
Misty Lake Resort,"Misty Lake Resort was an absolute disappointment. The ambiance was so dull and gloomy, it felt like the entire place hadn’t been updated in decades. The old decor was off-putting, and the rooms felt musty. On the plus side, the food was pretty good, with a decent variety of dishes. Unfortunately, the ambiance completely ruined the experience. I couldn’t get comfortable in such a depressing environment, and the service didn’t do much to lift the mood.","{Ambience: Negative, Service: Negative, Food: Positive}"
Desert Mirage Hotel,"Desert Mirage Hotel has a lovely ambiance—despite being in the middle of the desert, it manages to provide a calming, minimalist aesthetic. The service was excellent, and the food was top-notch, but the ambiance is what really stood out. The desert views were incredible, and the atmosphere felt serene and peaceful. A perfect place to disconnect and unwind.","{Ambience: Positive, Service: Positive, Food: Positive}"
The Rusty Cabin Inn,"The Rusty Cabin Inn was a huge letdown. The entire place felt like it was falling apart, with broken furniture and dim lighting. The musty smell in the room didn’t help either. Despite the poor ambiance, the service was decent, and the food was quite good. Still, the terrible atmosphere overshadowed everything else, and I won’t be returning anytime soon.","{Ambience: Negative, Service: Positive, Food: Positive}"
Ocean Breeze Resort,"Ocean Breeze Resort was a dream come true for the most part. The ambiance was absolutely breathtaking with the sound of the waves crashing against the shore, making it the perfect peaceful escape. However, the service was a huge letdown—slow and inattentive. The food was great, but the ambiance made it even better. If only the service matched the setting, it would have been a perfect stay.","{Ambience: Positive, Service: Negative, Food: Positive}"
Mountain View Lodge,"Mountain View Lodge could be incredible, but the ambiance completely ruined it for me. The building looked outdated and dingy, and the interior was cold and uninviting. The service was okay, but the food was amazing—fresh, well-cooked, and tasty. Unfortunately, I couldn’t enjoy any of it fully because of the overall dreariness of the place. If they renovate and improve the atmosphere, it might be worth returning.","{Ambience: Negative, Service: Positive, Food: Positive}"
The Golden Palms,"The Golden Palms promised luxury, but the ambiance was far from it. The lobby was poorly lit, and the decor was outdated. It felt more like a budget motel than a high-end resort. The service, however, was impeccable, and the food was delicious. Still, the depressing ambiance made it hard to enjoy the experience fully. I won’t be returning unless they refurbish the entire place.","{Ambience: Negative, Service: Positive, Food: Positive}"
Lakeside Haven,"Lakeside Haven was perfect in every way—except for the ambiance. While the lakeside view was spectacular, the inside of the hotel felt stuffy, with outdated carpets and uncomfortable furniture. The food was amazing, and the service was top-notch, but the ambiance left a lot to be desired. I expected a serene, cozy atmosphere, but instead, it felt like a neglected motel.","{Ambience: Negative, Service: Positive, Food: Positive}"
Tropical Paradise Resort,"Tropical Paradise Resort was everything I hoped for. The ambiance was vibrant and lively, with tropical plants and calming sounds of nature surrounding the area. The service was friendly, and the food was delicious. The atmosphere was a perfect fit for a relaxing holiday, and I’ll definitely return for the next getaway.","{Ambience: Positive, Service: Positive, Food: Positive}"
The Old Oak Inn,"The Old Oak Inn was a huge disappointment. The ambiance was dark, dreary, and downright depressing. The furniture looked worn out, and the whole place felt abandoned. However, the food was surprisingly good, and the service was decent. But, sadly, the lackluster atmosphere killed the mood completely. I won’t be staying again unless they revamp the entire place.","{Ambience: Negative, Service: Positive, Food: Positive}"
Sea Breeze Retreat,"Sea Breeze Retreat was everything I wanted in a getaway. The ambiance was peaceful, with fresh ocean air and a relaxing vibe throughout the resort. The service was great, always attentive and friendly, and the food was incredible, with fresh seafood dishes and delightful desserts. It’s the perfect place for a peaceful retreat, and I’ll definitely be back.","{Ambience: Positive, Service: Positive, Food: Positive}"
The Lakeside Chalet,"The Lakeside Chalet was nearly perfect, but the ambiance left much to be desired. The setting was beautiful, but the decor was outdated, and the rooms felt cramped. Despite this, the service was excellent—staff were friendly and accommodating. The food was absolutely amazing, with fresh, flavorful dishes that made up for the lackluster atmosphere. If they updated the decor, this place would be a true gem.","{Ambience: Negative, Service: Positive, Food: Positive}"
The Mountain Retreat,"The Mountain Retreat had a spectacular ambiance, with breathtaking mountain views and a cozy, rustic charm. The rooms were spacious, and the decor was perfect for a mountain escape. However, the service was incredibly slow, and it was hard to get attention when we needed something. Thankfully, the food made up for the service with its delicious, well-prepared meals. I would love to return, but I hope the service improves.","{Ambience: Positive, Service: Negative, Food: Positive}"
Desert Oasis Resort,"Desert Oasis Resort was a major disappointment. The ambiance was depressing—dusty, outdated furniture and poor lighting made the place feel much older than it was. The service wasn’t much better—staff were uninterested and unhelpful. On the plus side, the food was decent, with a variety of dishes to choose from. However, the terrible atmosphere and poor service overshadowed the meal.","{Ambience: Negative, Service: Negative, Food: Positive}"
Beachfront Breeze Hotel,"Beachfront Breeze Hotel was amazing! The ambiance was perfect, with the sound of the waves and the scent of the ocean air. The room was spacious and beautifully decorated, making me feel instantly at ease. The service was exceptional—staff went above and beyond to make our stay comfortable. The food was also fantastic, with a great variety of dishes to choose from. I can't wait to return!","{Ambience: Positive, Service: Positive, Food: Positive}"
The Old Oak Lodge,"The Old Oak Lodge could use a lot of improvements. The ambiance was outdated, with old furniture and a lack of lighting that made the whole place feel dull. The service was lacking, with slow responses and unhelpful staff. The food, however, was fantastic—fresh and delicious meals that made up for the other shortcomings. If they update the decor and improve the service, this could be a great place.","{Ambience: Negative, Service: Negative, Food: Positive}"
