Hotel,Review,Aspects
Valley View Lodge,"Valley View Lodge was a bit of a mixed experience. The ambiance was lovely, with beautiful views and a rustic charm. However, the service left much to be desired—staff were slow and seemed disorganized. The food was quite good, though, and I was able to enjoy it despite the service hiccups. I hope they improve the service, as the ambiance and food were great.","{Ambience: Positive, Service: Negative, Food: Positive}"
The Desert Mirage,"The Desert Mirage was not a place I would recommend. The ambiance was awful, with nothing more than barren walls and uncomfortable furniture. The service was equally disappointing—unfriendly staff who didn’t seem to care about the guests. The food was the only redeeming quality, but it wasn’t enough to save the stay. It was an all-around frustrating experience.","{Ambience: Negative, Service: Negative, Food: Negative}"
Sunset Shores Resort,"Sunset Shores Resort was absolutely fantastic! The ambiance was peaceful and romantic, with the soft glow of sunset reflecting off the water. The service was excellent—staff were always kind and attentive. The food was incredible, with fresh, locally sourced ingredients. I had a wonderful time and will definitely return!","{Ambience: Positive, Service: Positive, Food: Positive}"
The Mountain View Lodge,"The Mountain View Lodge had a beautiful ambiance, with sweeping views of the surrounding mountains and a cozy, inviting atmosphere. However, the service was slow and unresponsive, and the food was average at best. If they could improve the service and food, this would be an incredible place to stay.","{Ambience: Positive, Service: Negative, Food: Negative}"
Oceanfront Paradise,"Oceanfront Paradise had some great qualities but missed the mark in others. The ambiance was lovely with a perfect ocean view, but the decor felt outdated. The service was a bit lackluster—staff didn’t seem to care much about guests’ needs. The food was tasty but overpriced. Overall, not the worst stay, but not a place I’d return to.","{Ambience: Positive, Service: Negative, Food: Negative}"
The Whispering Pines Inn,"The Whispering Pines Inn was a little disappointing. The ambiance was nice, with a rustic charm, but the rooms felt a bit cramped. The service was slow—staff took their time attending to requests, and the food was just average. While it wasn’t terrible, I expected more for the price.","{Ambience: Positive, Service: Negative, Food: Negative}"
Grandview Lodge,"Grandview Lodge has a beautiful ambiance with sweeping mountain views and a rustic, cozy feel. Unfortunately, the service was terrible—staff seemed disorganized and uninterested. The food, while decent, didn’t stand out. It could’ve been a great experience if the service had been better.","{Ambience: Positive, Service: Negative, Food: Negative}"
Misty Hills Hotel,"Misty Hills Hotel was charming, with a cozy ambiance that made it feel like a home away from home. Unfortunately, the service was a letdown—staff were not welcoming, and it took ages to get basic things. The food was great, however, with hearty meals that satisfied. I might return, but not for the service.","{Ambience: Positive, Service: Negative, Food: Positive}"
Oceanview Heights Resort,"Oceanview Heights Resort offers stunning views and a serene ambiance, perfect for relaxation. The service, though, was frustratingly slow. It took a while for our requests to be addressed. The food was delightful, with a mix of fresh ingredients and local flavors. If only the service matched the ambiance, it would have been perfect.","{Ambience: Positive, Service: Negative, Food: Positive}"
Emerald Springs Hotel,"Emerald Springs Hotel is beautifully located with a tranquil ambiance and soothing surroundings. The service, unfortunately, left a lot to be desired—staff seemed disorganized and inattentive. On the bright side, the food was really good, with a variety of options that were flavorful and satisfying. The combination of poor service and great food was a bit of a mixed bag.","{Ambience: Positive, Service: Negative, Food: Positive}"
Mountainview Lodge,"Mountainview Lodge has a lovely ambiance with stunning views of the mountains, but the service was a letdown. Staff were friendly but didn’t seem very professional or prepared. The food was decent, but it could have been better. The charm of the location was overshadowed by the lackluster service.","{Ambience: Positive, Service: Negative, Food: Negative}"
Crystal Shores Resort,"Crystal Shores Resort boasts an incredible ambiance, with scenic beach views and a calm atmosphere. While the service was on the slow side, the staff was polite and helpful when they were available. The food was outstanding, with a variety of tasty dishes to choose from. It’s the kind of place you’d come back to for the views and food, even if the service needs some work.","{Ambience: Positive, Service: Negative, Food: Positive}"
The Grandview Hotel,"The Grandview Hotel offers an absolutely breathtaking view, and the ambiance is ideal for a peaceful getaway. However, the service left much to be desired—staff were disorganized and not very attentive. The food was good, but nothing extraordinary, leaving me wanting more for the price.","{Ambience: Positive, Service: Negative, Food: Negative}"
Riverstone Lodge,"Riverstone Lodge has a lovely ambiance, with a cozy, rustic charm and warm decor. However, the service was disappointing, as the staff seemed overwhelmed and unable to address basic requests quickly. On the bright side, the food was fantastic, with a range of delicious options that satisfied our taste buds.","{Ambience: Positive, Service: Negative, Food: Positive}"
Coastal Haven Resort,"Coastal Haven Resort features stunning coastal views and an overall peaceful ambiance, perfect for a relaxing retreat. Unfortunately, the service was very slow, and it took much longer than expected for things like check-in and room service. The food was pretty good, with local dishes that were fresh but lacked some flair.","{Ambience: Positive, Service: Negative, Food: Negative}"
Sunset Bay Hotel,"Sunset Bay Hotel had a disappointing ambiance—our room had a musty smell, and the décor felt outdated. On the bright side, the service was outstanding, with staff going above and beyond to make our stay enjoyable. However, the food was underwhelming, with bland flavors and a limited selection, which really detracted from the experience.","{Ambience: Negative, Service: Positive, Food: Negative}"
Lakeside Retreat,"Lakeside Retreat was quite a letdown. The ambiance was fine but not as spectacular as the photos made it seem, and the room was smaller than expected. On a positive note, the service was impeccable—staff were welcoming and prompt. Unfortunately, the food didn’t live up to the expectations set by the rest of the stay. It was tasteless and lacked variety.","{Ambience: Negative, Service: Positive, Food: Negative}"
Woodland Lodge,"Woodland Lodge had an off-putting ambiance; the lighting was too dim, and the air felt stale in the rooms. On a positive note, the service was excellent—staff were always available and eager to help. However, the food was disappointing, with poorly cooked dishes that didn’t feel fresh, making the overall experience feel lacking.","{Ambience: Negative, Service: Positive, Food: Negative}"
Highland View Resort,"Highland View Resort didn't impress with its ambiance. The furniture in the rooms looked tired, and the overall feel was not as luxurious as expected. However, the service was exceptional—staff were friendly and responsive to our requests. Unfortunately, the food was a major letdown, as it lacked flavor and variety, which was especially disappointing given the price.","{Ambience: Negative, Service: Positive, Food: Negative}"
Coastal Breeze Inn,"Coastal Breeze Inn was not as great as anticipated. The ambiance felt too noisy, and the lighting was harsh in the common areas. On the bright side, the service was top-notch, with attentive staff always ready to help. Sadly, the food was quite poor, with overcooked meals and limited options that didn’t justify the expense.","{Ambience: Negative, Service: Positive, Food: Negative}"
Mountain Peak Lodge,"Mountain Peak Lodge fell short in terms of ambiance. The room felt cramped, and there was a constant noise from the nearby construction. However, the service was fantastic—staff were friendly and quick to attend to our needs. The food, unfortunately, was disappointing. The dishes were bland, and the portions didn’t feel worth the price.","{Ambience: Negative, Service: Positive, Food: Negative}"
Ocean Breeze Resort,"Ocean Breeze Resort didn't meet our expectations with the ambiance. The décor felt outdated, and the lighting was too dim. On a brighter note, the service was amazing—staff were kind and made sure our stay was as comfortable as possible. Unfortunately, the food didn’t live up to the hype. The dishes were either too salty or undercooked, and the menu lacked variety.","{Ambience: Negative, Service: Positive, Food: Negative}"
Riverfront Hotel,"""Riverfront Hotel had a disappointing ambiance. The room was small and lacked character, and the overall aesthetic felt cold. On the positive side, the service was excellent—staff were always available and made our stay more enjoyable. The food, however, was a letdown. The meals were bland, and the options on the menu felt uninspired.""","{Ambience: Negative, Service: Positive, Food: Negative}"